{
  "$schema": "https://json-schema.org/draft/2020-12/schema", "type":"object", "additionalProperties":false,
  "required":["manual_events","corrections","suppress","duplicates","priorities","disabled_sources","parser_rules"],
  "properties": {
    "$schema":{"type":"string"},
    "publication_policy":{"enum":["verified_only","include_tentative"]},
    "manual_events":{"type":"array","items":{"$ref":"#/$defs/event"}},
    "corrections":{"type":"object","additionalProperties":{"type":"object","additionalProperties":false,"properties":{"title":{"type":"string","minLength":1},"start_date":{"type":"string","format":"date"},"end_date":{"type":["string","null"],"format":"date"},"start_time":{"type":["string","null"],"pattern":"^([01][0-9]|2[0-3]):[0-5][0-9]$"},"event_type":{"$ref":"#/$defs/type"},"description":{"type":"string"},"primary_url":{"type":"string","format":"uri"},"address":{"type":["string","null"]}}}},
    "suppress":{"type":"array","items":{"type":"string"},"uniqueItems":true},
    "duplicates":{"type":"object","additionalProperties":{"type":"string"}},
    "priorities":{"type":"object","additionalProperties":{"enum":["high","normal","low"]}},
    "disabled_sources":{"type":"array","items":{"type":"string"},"uniqueItems":true},
    "parser_rules":{"type":"object","additionalProperties":{"type":"object","additionalProperties":false,"properties":{"root":{"type":"string"},"title":{"type":"string"},"dates":{"type":"string"},"description":{"type":"string"},"event_type":{"$ref":"#/$defs/type"},"year":{"type":"integer","minimum":2000,"maximum":2100}}}}
  },
  "$defs":{
    "type":{"enum":["opening","exhibition","performance","talk","screening","tour","workshop","festival","other"]},
    "event":{"type":"object","required":["event_id","institution_id","title","event_type","start_date","primary_url"],"properties":{"event_id":{"type":"string","minLength":1},"institution_id":{"type":"string"},"title":{"type":"string","minLength":1},"event_type":{"$ref":"#/$defs/type"},"start_date":{"type":"string","format":"date"},"end_date":{"type":["string","null"],"format":"date"},"primary_url":{"type":"string","format":"uri"},"editor_verified_at":{"type":"string","format":"date-time"},"start_time":{"type":["string","null"],"pattern":"^([01][0-9]|2[0-3]):[0-5][0-9]$"},"description":{"type":"string"}}}
  }
}
