{
  "$schema": "./overrides.schema.json",
  "manual_events": [],
  "corrections": {},
  "suppress": [],
  "duplicates": {
    "EV_CB9C55BEEBF1AECAAB": "EV_CC6FF6666FE72B167B"
  },
  "priorities": {},
  "disabled_sources": [],
  "parser_rules": {
    "prpr312.ru": {
      "root": "body",
      "title": "h1",
      "dates": ".event-dates",
      "event_type": "exhibition"
    }
  },
  "publication_policy": "include_tentative"
}
